{
  "schema_version": "1.0",
  "strategy_id": "HYPE-15M-TB-MII-ENS-V2",
  "runner_kind": "hype_tb_mii_ensemble",
  "runner_commit": "53e4b6d",
  "lab_commit": "not-recorded-in-source-report",
  "snapshot_id": "hype-15m-tb-mii-ens-v2-replay-parity-2026-07-09",
  "gate_level": "parity",
  "command": "quant-runner replay-dry-run --name hype-tb-mii-ens-dry-run --limit 38900 --end-ts 2026-07-08T05:30:00Z",
  "window": {
    "start": "2025-06-16T02:30:00Z",
    "end": "2026-07-08T05:30:00Z",
    "bars": 37165
  },
  "trade_path": {
    "reference_trades": 291,
    "runtime_trades": 291,
    "path_mismatches": 0,
    "fields_compared": [
      "leg",
      "entry_ts",
      "exit_ts",
      "side",
      "exit_reason",
      "entry_price",
      "exit_price",
      "allocation"
    ]
  },
  "conclusion": "PASS",
  "blockers": [
    "schema projection of runner-tracking/hype-15m-tb-mii-ens-v2-runner-replay-parity-2026-07-09.md; V39 funding not in runner smoke path"
  ]
}
